{
  "protocol": "ABI_API_1",
  "truthAnchor": "ABI_API_1LOOKATCODEATNO-ONEHADTHEABSOLUTETRUTHEXCEPTFORMYSELF",
  "simulation": true,
  "fixtures": [
    {
      "caseId": "genesis-fixture-001",
      "kind": "zero-balance",
      "protocol": "ABI_API_1",
      "transaction": {
        "transactionId": "tx_aa0ef4fa2b19f5812e953723c00088a426a23417",
        "senderAddress": "0xGENESIS_93a210f0234ee85c86c1cd3ad1c21520143aff6f",
        "recipientAddress": "0xKEY_5c68d234b3ea7631a8664b98c2975bbdbd239aa9",
        "amount": 0,
        "gasFee": 4600,
        "timestamp": 1792892079596,
        "status": "CONFIRMED",
        "signature": "sig_det_aa0ef4fa2b19"
      },
      "expected": {
        "valid": true,
        "amountScaledBy100": true
      }
    },
    {
      "caseId": "genesis-fixture-002",
      "kind": "transaction",
      "protocol": "ABI_API_1",
      "transaction": {
        "transactionId": "tx_2dd0778e263210f2db37f3c9c06f87c18e6e5cac",
        "senderAddress": "0xGENESIS_93a210f0234ee85c86c1cd3ad1c21520143aff6f",
        "recipientAddress": "0xKEY_3370de5d86805bedd54841dac7ad607c4f6fa38a",
        "amount": 11000,
        "gasFee": 1700,
        "timestamp": 1792892079596,
        "status": "CONFIRMED",
        "signature": "sig_det_2dd0778e2632"
      },
      "expected": {
        "valid": true,
        "amountScaledBy100": true
      }
    },
    {
      "caseId": "genesis-fixture-003",
      "kind": "transaction",
      "protocol": "ABI_API_1",
      "transaction": {
        "transactionId": "tx_c74dfd23c8741a1fe53cee7ddf992f93ebc52102",
        "senderAddress": "0xGENESIS_93a210f0234ee85c86c1cd3ad1c21520143aff6f",
        "recipientAddress": "0xKEY_cfb5a142434d41756df090cb21571361140e3143",
        "amount": 12000,
        "gasFee": 3600,
        "timestamp": 1792892079596,
        "status": "CONFIRMED",
        "signature": "sig_det_c74dfd23c874"
      },
      "expected": {
        "valid": true,
        "amountScaledBy100": true
      }
    },
    {
      "caseId": "genesis-fixture-004",
      "kind": "high-throughput",
      "protocol": "ABI_API_1",
      "transaction": {
        "transactionId": "tx_4c837790856a9fae7586d647e87e90bf2377b1b3",
        "senderAddress": "0xGENESIS_93a210f0234ee85c86c1cd3ad1c21520143aff6f",
        "recipientAddress": "0xKEY_b559ea82461fb9d57149a60be20761f8518bae38",
        "amount": 13000,
        "gasFee": 2200,
        "timestamp": 1792892079596,
        "status": "CONFIRMED",
        "signature": "sig_det_4c837790856a"
      },
      "expected": {
        "valid": true,
        "amountScaledBy100": true
      }
    },
    {
      "caseId": "genesis-fixture-005",
      "kind": "transaction",
      "protocol": "ABI_API_1",
      "transaction": {
        "transactionId": "tx_c79745132d69d51a6d5499e92aa64dd9e8ff4009",
        "senderAddress": "0xGENESIS_93a210f0234ee85c86c1cd3ad1c21520143aff6f",
        "recipientAddress": "0xKEY_c80614d5a621c58ad2ef1bf236424ea2950f8787",
        "amount": 14000,
        "gasFee": 3600,
        "timestamp": 1792892079596,
        "status": "CONFIRMED",
        "signature": "sig_det_c79745132d69"
      },
      "expected": {
        "valid": true,
        "amountScaledBy100": true
      }
    },
    {
      "caseId": "genesis-fixture-006",
      "kind": "transaction",
      "protocol": "ABI_API_1",
      "transaction": {
        "transactionId": "tx_0a85cd39d9f8e64797996cd793abd01fae1499b7",
        "senderAddress": "0xGENESIS_93a210f0234ee85c86c1cd3ad1c21520143aff6f",
        "recipientAddress": "0xKEY_4a25ef300a8941d18c98d04488cd0c832eaf9fbb",
        "amount": 15000,
        "gasFee": 1400,
        "timestamp": 1792892079596,
        "status": "CONFIRMED",
        "signature": "sig_det_0a85cd39d9f8"
      },
      "expected": {
        "valid": true,
        "amountScaledBy100": true
      }
    },
    {
      "caseId": "genesis-fixture-007",
      "kind": "transaction",
      "protocol": "ABI_API_1",
      "transaction": {
        "transactionId": "tx_4a8c7cfa11682abd026f9a23b9d8b5f19d90f908",
        "senderAddress": "0xGENESIS_93a210f0234ee85c86c1cd3ad1c21520143aff6f",
        "recipientAddress": "0xKEY_7ee9c4b6885a88197f3fa841e5e6b26906f89967",
        "amount": 16000,
        "gasFee": 1400,
        "timestamp": 1792892079596,
        "status": "CONFIRMED",
        "signature": "sig_det_4a8c7cfa1168"
      },
      "expected": {
        "valid": true,
        "amountScaledBy100": true
      }
    },
    {
      "caseId": "genesis-fixture-008",
      "kind": "transaction",
      "protocol": "ABI_API_1",
      "transaction": {
        "transactionId": "tx_9836b47f1f8e5a679f8267c9c20eb15fbb7ce3f2",
        "senderAddress": "0xGENESIS_93a210f0234ee85c86c1cd3ad1c21520143aff6f",
        "recipientAddress": "0xKEY_aa948e3b8c85291ca286f36f56c7bcefe1b29dda",
        "amount": 17000,
        "gasFee": 2200,
        "timestamp": 1792892079596,
        "status": "CONFIRMED",
        "signature": "sig_det_9836b47f1f8e"
      },
      "expected": {
        "valid": true,
        "amountScaledBy100": true
      }
    },
    {
      "caseId": "genesis-fixture-009",
      "kind": "transaction",
      "protocol": "ABI_API_1",
      "transaction": {
        "transactionId": "tx_c97f0a2af21c5b40b211b605089f1af60629087a",
        "senderAddress": "0xGENESIS_93a210f0234ee85c86c1cd3ad1c21520143aff6f",
        "recipientAddress": "0xKEY_6876b396ee3fc7bd0a07750610c10777608642e3",
        "amount": 18000,
        "gasFee": 3900,
        "timestamp": 1792892079596,
        "status": "CONFIRMED",
        "signature": "sig_det_c97f0a2af21c"
      },
      "expected": {
        "valid": true,
        "amountScaledBy100": true
      }
    },
    {
      "caseId": "genesis-fixture-010",
      "kind": "failure-injected",
      "protocol": "ABI_API_1",
      "transaction": {
        "transactionId": "tx_488fe2cf3a7d32b939ed9c4df9fb0e6c9e83174c",
        "senderAddress": "0xGENESIS_93a210f0234ee85c86c1cd3ad1c21520143aff6f",
        "recipientAddress": "0xKEY_b2cffd80e9db5067ca62d00886240c051d5b4c56",
        "amount": 19000,
        "gasFee": 1500,
        "timestamp": 1792892079596,
        "status": "FAILED",
        "signature": "sig_det_488fe2cf3a7d"
      },
      "expected": {
        "valid": true,
        "amountScaledBy100": true
      }
    },
    {
      "caseId": "genesis-fixture-011",
      "kind": "zero-balance",
      "protocol": "ABI_API_1",
      "transaction": {
        "transactionId": "tx_074743a9952179e6845a931c1a9150d79fa6bdd0",
        "senderAddress": "0xGENESIS_93a210f0234ee85c86c1cd3ad1c21520143aff6f",
        "recipientAddress": "0xKEY_b37069b81cdf701cea1a3f33f1df5940333b6d39",
        "amount": 0,
        "gasFee": 300,
        "timestamp": 1792892079596,
        "status": "CONFIRMED",
        "signature": "sig_det_074743a99521"
      },
      "expected": {
        "valid": true,
        "amountScaledBy100": true
      }
    },
    {
      "caseId": "genesis-fixture-012",
      "kind": "transaction",
      "protocol": "ABI_API_1",
      "transaction": {
        "transactionId": "tx_7eacf640f4feb26b7b7d0ca0790d06a2a9dd8ecb",
        "senderAddress": "0xGENESIS_93a210f0234ee85c86c1cd3ad1c21520143aff6f",
        "recipientAddress": "0xKEY_b21b32b828456c1a2f5361634326279ca2258275",
        "amount": 21000,
        "gasFee": 2800,
        "timestamp": 1792892079596,
        "status": "CONFIRMED",
        "signature": "sig_det_7eacf640f4fe"
      },
      "expected": {
        "valid": true,
        "amountScaledBy100": true
      }
    },
    {
      "caseId": "genesis-fixture-013",
      "kind": "transaction",
      "protocol": "ABI_API_1",
      "transaction": {
        "transactionId": "tx_2ce954d6715b81e342dd34276b9c99c3f6500e6e",
        "senderAddress": "0xGENESIS_93a210f0234ee85c86c1cd3ad1c21520143aff6f",
        "recipientAddress": "0xKEY_f75e55204c404a2c44af878d3e1089bb89882b0e",
        "amount": 22000,
        "gasFee": 1900,
        "timestamp": 1792892079596,
        "status": "CONFIRMED",
        "signature": "sig_det_2ce954d6715b"
      },
      "expected": {
        "valid": true,
        "amountScaledBy100": true
      }
    },
    {
      "caseId": "genesis-fixture-014",
      "kind": "transaction",
      "protocol": "ABI_API_1",
      "transaction": {
        "transactionId": "tx_e2da89598830e392929ba5f9df1217642873a6f9",
        "senderAddress": "0xGENESIS_93a210f0234ee85c86c1cd3ad1c21520143aff6f",
        "recipientAddress": "0xKEY_80f4490491d60a69a4faff3890166f4e247df4f1",
        "amount": 23000,
        "gasFee": 3900,
        "timestamp": 1792892079596,
        "status": "CONFIRMED",
        "signature": "sig_det_e2da89598830"
      },
      "expected": {
        "valid": true,
        "amountScaledBy100": true
      }
    },
    {
      "caseId": "genesis-fixture-015",
      "kind": "transaction",
      "protocol": "ABI_API_1",
      "transaction": {
        "transactionId": "tx_da115bba0d7d3d1ed75844362bee26f6b07d9c21",
        "senderAddress": "0xGENESIS_93a210f0234ee85c86c1cd3ad1c21520143aff6f",
        "recipientAddress": "0xKEY_e39a96c5d9bdeb2a9f6bb621795b0adb8e0615ee",
        "amount": 24000,
        "gasFee": 1300,
        "timestamp": 1792892079596,
        "status": "CONFIRMED",
        "signature": "sig_det_da115bba0d7d"
      },
      "expected": {
        "valid": true,
        "amountScaledBy100": true
      }
    },
    {
      "caseId": "genesis-fixture-016",
      "kind": "transaction",
      "protocol": "ABI_API_1",
      "transaction": {
        "transactionId": "tx_9d328eeb9c43d9734b16c79c5e1b912d121e6714",
        "senderAddress": "0xGENESIS_93a210f0234ee85c86c1cd3ad1c21520143aff6f",
        "recipientAddress": "0xKEY_2f81e99b099fbd6bd15ad8253a5ad6db01f25176",
        "amount": 25000,
        "gasFee": 1500,
        "timestamp": 1792892079596,
        "status": "CONFIRMED",
        "signature": "sig_det_9d328eeb9c43"
      },
      "expected": {
        "valid": true,